index,GHO (CODE),GHO (DISPLAY),GHO (URL),PUBLISHSTATE (CODE),PUBLISHSTATE (DISPLAY),PUBLISHSTATE (URL),YEAR (CODE),YEAR (DISPLAY),YEAR (URL),REGION (CODE),REGION (DISPLAY),REGION (URL),COUNTRY (CODE),STARTYEAR,ENDYEAR,COUNTRY (DISPLAY),COUNTRY (URL),GOEQUESTION (CODE),GOEQUESTION (DISPLAY),GOEQUESTION (URL),Display Value,Numeric,Low,High,StdErr,StdDev,Comments
86,GOE_Q199,Insufficient incentives for data sharing,https://www.who.int/data/gho/indicator-metadata-registry/imr-details/4799,PUBLISHED,Published,,2015.0,2015,,WPR,Western Pacific,,PHL,2015,2015,Philippines,,GOEQUESTION018,Barriers to adopting big data for health,,Extremely important barrier,,,,,,
87,GOE_Q202,Research into new analytical methods needs occur to meet the challenges of working with big data,https://www.who.int/data/gho/indicator-metadata-registry/imr-details/4799,PUBLISHED,Published,,2015.0,2015,,WPR,Western Pacific,,PHL,2015,2015,Philippines,,GOEQUESTION018,Barriers to adopting big data for health,,Extremely important barrier,,,,,,
88,GOE_Q197,Country has national policy or strategy regulating the use of big data by private companies,https://www.who.int/data/gho/indicator-metadata-registry/imr-details/4798,PUBLISHED,Published,,2015.0,2015,,WPR,Western Pacific,,PHL,2015,2015,Philippines,,,,,No,,,,,,
89,GOE_Q203,Lack of integration between various health services,https://www.who.int/data/gho/indicator-metadata-registry/imr-details/4799,PUBLISHED,Published,,2015.0,2015,,WPR,Western Pacific,,PHL,2015,2015,Philippines,,GOEQUESTION018,Barriers to adopting big data for health,,Extremely important barrier,,,,,,
90,GOE_Q201,Privacy and security laws need to be in place,https://www.who.int/data/gho/indicator-metadata-registry/imr-details/4799,PUBLISHED,Published,,2015.0,2015,,WPR,Western Pacific,,PHL,2015,2015,Philippines,,GOEQUESTION018,Barriers to adopting big data for health,,Extremely important barrier,,,,,,
91,GOE_Q198,Effective standards and best practices for data capture not fully established,https://www.who.int/data/gho/indicator-metadata-registry/imr-details/4799,PUBLISHED,Published,,2015.0,2015,,WPR,Western Pacific,,PHL,2015,2015,Philippines,,GOEQUESTION018,Barriers to adopting big data for health,,Extremely important barrier,,,,,,
92,GOE_Q200,Capacity building required for new skills,https://www.who.int/data/gho/indicator-metadata-registry/imr-details/4799,PUBLISHED,Published,,2015.0,2015,,WPR,Western Pacific,,PHL,2015,2015,Philippines,,GOEQUESTION018,Barriers to adopting big data for health,,Extremely important barrier,,,,,,
